app_name,score,review_text,label,clean_review,text_len
toss,1,"여러분들의 댓글요정 혜해 입니다. 오래전 토스 간편결제에서 시작한 토스뱅크를 오랜만에 다시 가입하여 보니, 바로 뒤로가기를 연타할 만큼 사용후기는 매우 실망 스러웠읍니다. 너무 불필요한 광고 및 문어발식 메뉴들. 별점 1개. (왜 이리 복잡하게 된건지) 다시 사용하고 싶다는 생각을 말끔하게 접게 되었어요. 옛날 토스는 미니멀하고 간편하고 애플리케이션이 가벼웠는데. 이제는 초심을 잃어버린 돈에 눈이 멀어버린 마치 광고 대행사 같은 그런 기업 같아서 실망을 안고 떠나갑니다.",2,"여러분들의 댓글요정 혜해 입니다. 오래전 토스 간편결제에서 시작한 토스뱅크를 오랜만에 다시 가입하여 보니, 바로 뒤로가기를 연타할 만큼 사용후기는 매우 실망 스러웠읍니다. 너무 불필요한 광고 및 문어발식 메뉴들. 별점 1개. 왜 이리 복잡하게 된건지 다시 사용하고 싶다는 생각을 말끔하게 접게 되었어요. 옛날 토스는 미니멀하고 간편하고 애플리케이션이 가벼웠는데. 이제는 초심을 잃어버린 돈에 눈이 멀어버린 마치 광고 대행사 같은 그런 기업 같아서 실망을 안고 떠나갑니다.",263
kbbank,5,이용이 편리해요,0,이용이 편리해요,8
toss,3,"버그. 걸음 알림을 허용했으나, 돌아와보면 다시 꺼져있고 계속 무한으로 물어봄",2,"버그. 걸음 알림을 허용했으나, 돌아와보면 다시 꺼져있고 계속 무한으로 물어봄",43
toss,1,토스에 함께토스켜기 누르면 화면이 자꾸 반짝거려요 그러다 안뜰때도있고요 업데이트 해야하나요 ?,1,토스에 함께토스켜기 누르면 화면이 자꾸 반짝거려요 그러다 안뜰때도있고요 업데이트 해야하나요 ?,52
kbbank,5,적금 가입위해 처음 인증서 내려 받으려니 조금 두려웠는데 생각보다 쉽게 잘 가압할 수 있었어요.,0,적금 가입위해 처음 인증서 내려 받으려니 조금 두려웠는데 생각보다 쉽게 잘 가압할 수 있었어요.,53
kbbank,5,캐나다에서 1달전 갱신시 한국전화로 안전코드 받으라해 포기했는데 이번엔 그런 절차가 없어져 갱신했어요! 대단히 감사합니다~!!!,0,캐나다에서 1달전 갱신시 한국전화로 안전코드 받으라해 포기했는데 이번엔 그런 절차가 없어져 갱신했어요! 대단히 감사합니다~!!,70
kakaopay,1,야간에 알람좀 그만.보내요 잠을못자요,2,야간에 알람좀 그만.보내요 잠을못자요,20
toss,1,"광고, 앱 내 팝업, 페이스페이 강요 등으로 가득하다. 민원사항을 적어주시면 답변은 모두 AI 답변입니다. 무슨 말을 하는지 모르겠어요. 고객 서비스에 문의하세요. 하하. 다른 앱을 찾아봐야겠네요.",2,"광고, 앱 내 팝업, 페이스페이 강요 등으로 가득하다. 민원사항을 적어주시면 답변은 모두 AI 답변입니다. 무슨 말을 하는지 모르겠어요. 고객 서비스에 문의하세요. 하하. 다른 앱을 찾아봐야겠네요.",110
kbbank,5,good enough,0,good enough,11
kakaopay,1,앱을 열리지 않아서 삭제하고 다시 열어요 왜 페이가 열리지 않죠,2,앱을 열리지 않아서 삭제하고 다시 열어요 왜 페이가 열리지 않죠,35
toss,1,한도초과라서 결제는 안 됐는데 왜 포인트는 나가는거죠...?,1,한도초과라서 결제는 안 됐는데 왜 포인트는 나가는거죠..?,32
toss,1,"와, 정말 말도 안 돼요. 일종의 모바일 티머니라고 하는데 3만원을 충전했는데 인식이 안됩니다. 무슨 일이야? ㅎㅎ 고객센터에 문의를 넣어도 전화가 많이 오네요. 토스는 고객을 개처럼 대하나요? 토스를 2년째 사용하고 있는데 다른 앱으로 전환하려고 합니다.",2,"와, 정말 말도 안 돼요. 일종의 모바일 티머니라고 하는데 3만원을 충전했는데 인식이 안됩니다. 무슨 일이야? ㅎㅎ 고객센터에 문의를 넣어도 전화가 많이 오네요. 토스는 고객을 개처럼 대하나요? 토스를 2년째 사용하고 있는데 다른 앱으로 전환하려고 합니다.",143
kbbank,1,별 하나도 아깝지 않습니다. 인증하려고 하면 쫓겨납니다. 인증은 몇 번이나 해야 하나요?? 한시간만 인증하고 나가면 됩니다.,2,별 하나도 아깝지 않습니다. 인증하려고 하면 쫓겨납니다. 인증은 몇 번이나 해야 하나요?? 한시간만 인증하고 나가면 됩니다.,69
kbbank,5,사용이 쉽고 간편해요,0,사용이 쉽고 간편해요,11
kakaopay,2,네이버페이쓰다 넘어왔는데 너무느림 3g쓰지만 차이가많이남 계산할때마다 당황스럽고 짜증남,2,네이버페이쓰다 넘어왔는데 너무느림 3g쓰지만 차이가많이남 계산할때마다 당황스럽고 짜증남,48
kbbank,5,굳굳,0,굳굳,2
toss,1,업데이트가 작동하지 않나요? 계속 실패하다,1,업데이트가 작동하지 않나요? 계속 실패하다,23
kakaopay,2,업데이트하고 카카오 증권을 쓰는 것이 불편합니다. 주식을 1주일 구입하려고 입력하면 원래 평가가 나왔는데 지금은 구매 후 예상이 퍼센트로 떠오르고 있습니다. 평단가도 중요하지만 금액이 바로 보이지 않기 때문에 구입하는 것은 매우 불편합니다.,2,업데이트하고 카카오 증권을 쓰는 것이 불편합니다. 주식을 1주일 구입하려고 입력하면 원래 평가가 나왔는데 지금은 구매 후 예상이 퍼센트로 떠오르고 있습니다. 평단가도 중요하지만 금액이 바로 보이지 않기 때문에 구입하는 것은 매우 불편합니다.,134
toss,1,범죄자 및 사기꾼 새끼들 애용 은행. 사기꾼 놈들 상대로 장사하는 기업,2,범죄자 및 사기꾼 새끼들 애용 은행. 사기꾼 놈들 상대로 장사하는 기업,39
kakaopay,1,교통카드 꼭 결정적일 때 안돼서 앱 열어줘야 함. 그러다가 전철 놓치고 버스 하차태그 못하면 개쌍욕나옴,2,교통카드 꼭 결정적일 때 안돼서 앱 열어줘야 함. 그러다가 전철 놓치고 버스 하차태그 못하면 개쌍욕나옴,57
kakaopay,1,별 드르븐 어플 다보겠네 탈퇴도 내맘대로 못하게하네,2,별 드르븐 어플 다보겠네 탈퇴도 내맘대로 못하게하네,28
kakaopay,3,좋아여,0,좋아여,3
kakaopay,1,"페이 카드 분실로 재발급을 신청했는데 신분증 대비 외형 변화(머리 스타일)로 얼굴 인식이 반복적으로 인증이 안되고 시도 횟수까지 차감되는 구조는 사용자 입장에서 매우 불합리하게 느껴지며, 단순 재발급임에도 과도한 인증 절차가 요구할필요가? 됐어 안해~ 접어",2,"페이 카드 분실로 재발급을 신청했는데 신분증 대비 외형 변화 머리 스타일 로 얼굴 인식이 반복적으로 인증이 안되고 시도 횟수까지 차감되는 구조는 사용자 입장에서 매우 불합리하게 느껴지며, 단순 재발급임에도 과도한 인증 절차가 요구할필요가? 됐어 안해~ 접어",143
kbbank,4,"같은 계좌로 다건이체시, 예금주명을 각각 다르게 보내는데도(같은계좌에 다른예금주명으로 여러번 송금) 이체확인증 확인하면 동일하게 이름만 기록이 됩니다",1,"같은 계좌로 다건이체시, 예금주명을 각각 다르게 보내는데도 같은계좌에 다른예금주명으로 여러번 송금 이체확인증 확인하면 동일하게 이름만 기록이 됩니다",82
kbbank,5,편함,0,편함,2
toss,1,최악의 앱. 서비스 최악임. cs 실컷 설명하니 자기일 아니라고 다른곳 링크만 보냄. 절대 안씁니다.,2,최악의 앱. 서비스 최악임. cs 실컷 설명하니 자기일 아니라고 다른곳 링크만 보냄. 절대 안씁니다.,56
toss,1,"아니 저번에 국세청 앱으로 환급신청 완료 했는데 왜자꾸 환급신청 하라고 졸라대노. 것도 내 돈 돌려받는다는데, 수수료를 만원씩이나 뜯어가네. 양심 어딨냐",2,"아니 저번에 국세청 앱으로 환급신청 완료 했는데 왜자꾸 환급신청 하라고 졸라대노. 것도 내 돈 돌려받는다는데, 수수료를 만원씩이나 뜯어가네. 양심 어딨냐",85
kbbank,1,이정도로 본인인증 중에 초기화 자주 되는 앱은 처음임 회원가입에만 7번은 시도한 거 같음,2,이정도로 본인인증 중에 초기화 자주 되는 앱은 처음임 회원가입에만 7번은 시도한 거 같음,49
toss,1,"라방 보기, 각종 미니앱들 쓸 때 렉이 너무 심하게 걸립니다 지웠다 다시 깔고 공간 정리도 하고 캐시 삭제도 다 해봤는데 나아지는 게 없네요 폰 문제는 아닌 게 토스 말고 다른 앱들은 전혀 안 그럽니다. 광고 보는 것도 짜증나는데 계속 화면 멈추고 터치 동작 느리게 먹는 거 진짜 속 터져 죽음",2,"라방 보기, 각종 미니앱들 쓸 때 렉이 너무 심하게 걸립니다 지웠다 다시 깔고 공간 정리도 하고 캐시 삭제도 다 해봤는데 나아지는 게 없네요 폰 문제는 아닌 게 토스 말고 다른 앱들은 전혀 안 그럽니다. 광고 보는 것도 짜증나는데 계속 화면 멈추고 터치 동작 느리게 먹는 거 진짜 속 터져 죽음",164
kbbank,5,아주 좋아요,0,아주 좋아요,6
kbbank,5,간편하고 사용하기가 너무 편하고 화면도 깔끔합니다.고객들에게 좀더 저렴한 금리로 대출 해주세요,0,간편하고 사용하기가 너무 편하고 화면도 깔끔합니다.고객들에게 좀더 저렴한 금리로 대출 해주세요,52
kbbank,4,Geloxy Fold 앱을 사용할 때 부드러운 화면이 없습니다 ㅠㅡㅠ,1,Geloxy Fold 앱을 사용할 때 부드러운 화면이 없습니다 ㅠㅡㅠ,38
toss,5,최고,0,최고,2
kakaopay,1,저는 카카오페이앱이 처음이라서...한번 해봤는데 휴대폰 인증까지 잘됐지만 신분증 인증을 찍어서 눌렀는데 계속 안돼요...빨리 고쳐주세요,1,저는 카카오페이앱이 처음이라서..한번 해봤는데 휴대폰 인증까지 잘됐지만 신분증 인증을 찍어서 눌렀는데 계속 안돼요..빨리 고쳐주세요,73
toss,1,환불이 있기 때문에 신청 수수료는 받자마자 오류를 떠올리는 것은 나뿐입니까? 장난을 치십시오. 고객 센터가 하루 종일 전화에 연결할 수 없습니다.,2,환불이 있기 때문에 신청 수수료는 받자마자 오류를 떠올리는 것은 나뿐입니까? 장난을 치십시오. 고객 센터가 하루 종일 전화에 연결할 수 없습니다.,81
toss,1,토스 증권이 요즘따라 안들어가져요..,2,토스 증권이 요즘따라 안들어가져요..,20
kakaopay,1,갑자기 로그아웃하면 다시 인증하라고 합니다. 인증하려고하지만 아직 없습니다. 무슨 일이야?,1,갑자기 로그아웃하면 다시 인증하라고 합니다. 인증하려고하지만 아직 없습니다. 무슨 일이야?,50
toss,1,광고도 점점 길어지고 앱 테크로서 더 이상 이점이 없습니다. 복권도 어떤 5년 동안 했지만 약간 8등 당선된 것이 최고다.,2,광고도 점점 길어지고 앱 테크로서 더 이상 이점이 없습니다. 복권도 어떤 5년 동안 했지만 약간 8등 당선된 것이 최고다.,68
kakaopay,1,다시 사용하지 않습니다.,2,다시 사용하지 않습니다.,13
kakaopay,1,기껏 광고 보게 해놓고 3p??? 보너스라고 해놓고 또 광고봤는데 2p? 왜 1p로 주지? 게다가 광고는 성인몰 광고 성인게임 광고 분명히 아이들도 이 앱을 쓸텐데? 광고는 또 스킵 안되게 해놓고 강제로 플레이스토어 2번 보게 만들고 이러니 다른 페이한테 잡아 먹히고 있지 곧 손절할 거 같습니다,2,기껏 광고 보게 해놓고 3p?? 보너스라고 해놓고 또 광고봤는데 2p? 왜 1p로 주지? 게다가 광고는 성인몰 광고 성인게임 광고 분명히 아이들도 이 앱을 쓸텐데? 광고는 또 스킵 안되게 해놓고 강제로 플레이스토어 2번 보게 만들고 이러니 다른 페이한테 잡아 먹히고 있지 곧 손절할 거 같습니다,164
kakaopay,1,쓰레기 토스를 보고 배워보세요.,2,쓰레기 토스를 보고 배워보세요.,17
kakaopay,1,광고를 보고 포인트를 받는 것은 당연한 일이지만 광고 3개를 동시에 1분 이상 시청하는 것은 좀 어리석은 일이지만 그렇게 생각해보자. 그런데 광고 3개를 일일이 클릭해서 닫아야 하는 건 너무 어리석은 일 아닌가요?,2,광고를 보고 포인트를 받는 것은 당연한 일이지만 광고 3개를 동시에 1분 이상 시청하는 것은 좀 어리석은 일이지만 그렇게 생각해보자. 그런데 광고 3개를 일일이 클릭해서 닫아야 하는 건 너무 어리석은 일 아닌가요?,119
kbbank,5,간편하게 정기예금 가입 가능해서 좋았습니다 이제는 저축상품도 앱으로 하게되네요,0,간편하게 정기예금 가입 가능해서 좋았습니다 이제는 저축상품도 앱으로 하게되네요,43
kakaopay,1,인앱 여기저기 납치광고,2,인앱 여기저기 납치광고,12
toss,1,어린이라서 부모님 동의를 받는건 이해되지만 계속 해서 지속하고 부모님 인증 하면 폰 인증 하면 또 비밀번호 인증 인증 토스는 인증을 좋아하는거같음. 그리고 그러 거의 다하면 또 인증서 갖고 오지 못했다며 처음으로 돌아가집니다. 이러면 제 20분은 날려먹게 되는거죠. 토스는 카카오뱅크보다 자유롭진 않은듯. 지금 몇번을 해도 저래서 토스 다신 안합니다.(욕 쓰고 싶지만 참고있어요),2,어린이라서 부모님 동의를 받는건 이해되지만 계속 해서 지속하고 부모님 인증 하면 폰 인증 하면 또 비밀번호 인증 인증 토스는 인증을 좋아하는거같음. 그리고 그러 거의 다하면 또 인증서 갖고 오지 못했다며 처음으로 돌아가집니다. 이러면 제 20분은 날려먹게 되는거죠. 토스는 카카오뱅크보다 자유롭진 않은듯. 지금 몇번을 해도 저래서 토스 다신 안합니다. 욕 쓰고 싶지만 참고있어요,211
kbbank,2,지난달까지는 멀쩡하다가 갑자기 OTP 비밀번호 입력하라는건 왜그런거죠 ? 갑자기 너무 일방적인것 같네요. 출장와서 이체하려는데 갑자기 뭔 상황인지 ...,2,지난달까지는 멀쩡하다가 갑자기 OTP 비밀번호 입력하라는건 왜그런거죠 ? 갑자기 너무 일방적인것 같네요. 출장와서 이체하려는데 갑자기 뭔 상황인지 ..,84
kakaopay,1,"무언가를 결제하면 돈이 나가지만, 결제가 이루어지지 않으면 돈이 다시 Pay로 돌아가서 끝없이 반복됩니다.",2,"무언가를 결제하면 돈이 나가지만, 결제가 이루어지지 않으면 돈이 다시 Pay로 돌아가서 끝없이 반복됩니다.",59
kakaopay,3,예수금을 어디서 확인되나요 일주일을 찾아도 찾을수가 없네요,1,예수금을 어디서 확인되나요 일주일을 찾아도 찾을수가 없네요,32
toss,4,"간편하게 잘 사용하고있습니다! 다만 한가지 기능 건의 드리고싶어요. 증권에서 투자비중 볼때, 증권계좌에 있는 현금 비중도 추가됐으면 좋겠습니다!!",1,"간편하게 잘 사용하고있습니다! 다만 한가지 기능 건의 드리고싶어요. 증권에서 투자비중 볼때, 증권계좌에 있는 현금 비중도 추가됐으면 좋겠습니다!!",81
kakaopay,1,무능한것들아 구현 못하면 배포를 늦추던 긴급수정을 하든 해야될거아냐 분수에 안맞는 개발 어휴,2,무능한것들아 구현 못하면 배포를 늦추던 긴급수정을 하든 해야될거아냐 분수에 안맞는 개발 어휴,51
kbbank,5,편리해서 좋아요 안전하게 관리부탁해요,0,편리해서 좋아요 안전하게 관리부탁해요,20
toss,1,운세 이용하게 하는 게 싫어요.,2,운세 이용하게 하는 게 싫어요.,17
kakaopay,1,아니 맨날 증권 연결상태 안좋은거 해결안하나?,2,아니 맨날 증권 연결상태 안좋은거 해결안하나?,25
kbbank,5,편리하고 좋습니다.,0,편리하고 좋습니다.,10
kakaopay,1,"개인정보 재확인으로 송금 기능을 막을거면 충전할 때 인지시켜야지, 충전만 가능하게 하고 송금을 막으면, 내 계좌로 돈 다시 돌려놓을 수도 없는데 잘못됨. 모바일 신분증 지원 안 하는 것도 좀 카카오페이라는 기업에 비해 짜침",2,"개인정보 재확인으로 송금 기능을 막을거면 충전할 때 인지시켜야지, 충전만 가능하게 하고 송금을 막으면, 내 계좌로 돈 다시 돌려놓을 수도 없는데 잘못됨. 모바일 신분증 지원 안 하는 것도 좀 카카오페이라는 기업에 비해 짜침",124
kbbank,5,kb스타뱅킹앱이야 말로 우리가 재산을 믿고 맡길수 있는 가장 보안이 잘된 정확한 앱이라고 생각합니다 !,0,kb스타뱅킹앱이야 말로 우리가 재산을 믿고 맡길수 있는 가장 보안이 잘된 정확한 앱이라고 생각합니다 !,57
kakaopay,2,근데 실시간까진 바라지 읺는데 주식 현재가가 바뀌질 않는건 무엇일까요?,1,근데 실시간까진 바라지 읺는데 주식 현재가가 바뀌질 않는건 무엇일까요?,39
kbbank,5,간편해요,0,간편해요,4
toss,1,"이벤트 참여 겸 하루에 매장 2곳을 갔는데 결제에 실패했습니다. 일부러 지도에 있는 곳으로 갔는데 결제가 되지도 않고, 가게 사장님도 다른 분들도 결제를 못 했다고 하더군요. 그러면 일부러 페이스페이 매장을 찾아가는 의미가 없습니다. 그리고 고객센터에 문의하니 쿠폰 사용이 되지 않아 결제한 건에 대해서 보상 방안이 마련되지도 않았습니다. 결국 기기 및 서버 환경만 운운하면서 핑계만 늘어놓더군요. 더 이상 제 정보를 토스에 남기고 싶지 않네요. 토스 증권, 은행, 카드 탈퇴합니다.",2,"이벤트 참여 겸 하루에 매장 2곳을 갔는데 결제에 실패했습니다. 일부러 지도에 있는 곳으로 갔는데 결제가 되지도 않고, 가게 사장님도 다른 분들도 결제를 못 했다고 하더군요. 그러면 일부러 페이스페이 매장을 찾아가는 의미가 없습니다. 그리고 고객센터에 문의하니 쿠폰 사용이 되지 않아 결제한 건에 대해서 보상 방안이 마련되지도 않았습니다. 결국 기기 및 서버 환경만 운운하면서 핑계만 늘어놓더군요. 더 이상 제 정보를 토스에 남기고 싶지 않네요. 토스 증권, 은행, 카드 탈퇴합니다.",270
kakaopay,4,카삼페 이벤트 한다길래 굳이굳이 썼는데 이게 방식이 혜택 응모하기를 누르고나서 결제를 해야만 된다네요? 저는 모르고 결제부터 했는데 카카오의 의도를 알아채지 못했네요. 앞으로도 그 의도 잘 숨기시고 불편하게 잘 만들어주세요. 지금까지 잘 썼습니다. 감사합니다.,2,카삼페 이벤트 한다길래 굳이굳이 썼는데 이게 방식이 혜택 응모하기를 누르고나서 결제를 해야만 된다네요? 저는 모르고 결제부터 했는데 카카오의 의도를 알아채지 못했네요. 앞으로도 그 의도 잘 숨기시고 불편하게 잘 만들어주세요. 지금까지 잘 썼습니다. 감사합니다.,145
kbbank,5,사용 안내가 잘 되어있어서 혼자서도 잘 할 수 있네요.,0,사용 안내가 잘 되어있어서 혼자서도 잘 할 수 있네요.,30
kakaopay,1,아니 내 결제내역 보려면 도대체 어디로 가야되냐? 카톡도 그렇더니 아주 UX 말아먹었네,2,아니 내 결제내역 보려면 도대체 어디로 가야되냐? 카톡도 그렇더니 아주 UX 말아먹었네,48
kakaopay,1,앱 실행이 안됩니다. 무한 로딩 걸린 상태로 아무것도 안돼요,2,앱 실행이 안됩니다. 무한 로딩 걸린 상태로 아무것도 안돼요,33
kbbank,2,신분증 사진 주민등록증 인식 안된다고 재촬영 76번 찍다 지쳐서 신한은랭으로 옮겼더,2,신분증 사진 주민등록증 인식 안된다고 재촬영 76번 찍다 지쳐서 신한은랭으로 옮겼더,46
toss,2,어플이 너무 산만함; 접근성이 너무 별로여서 팝업에 납치당해서 실수로 들어왔다가도 질색하고 나가게 됨. 토스 자체엔 딱히 유감 없는데 어플은 좀 개선되면 좋겠음.,2,어플이 너무 산만함 접근성이 너무 별로여서 팝업에 납치당해서 실수로 들어왔다가도 질색하고 나가게 됨. 토스 자체엔 딱히 유감 없는데 어플은 좀 개선되면 좋겠음.,89
kakaopay,3,"카카오페이 몇년째 사용중인데 요즘 상태가 많이 않좋아졌어요 증권도 하고 포인트 모으기도 하면서 시간날때면 항상 페이앱을 열어놓고 있는데 5분정도 사용하면 앱이 다운됩니다. 이상한것은 다운되면 전체가 그런게 아니라 결제창은 잘 열립니다. 가끔 홈창도 열릴때가 있고 하지만 혜택 자산, 증권은 안열립니다. 고객센터 문의했지만 이상 없다고하고 플레이스토어 가서 업데이트 하라고 하고 휴대폰 다시시작해서 사용하라해서 다 해봤는데 똑같아요. 어찌합니까? 내 폰때문일까요? 여태 잘 쓰다가 요즘에 그런건데 답답합니다. 누가 현답 좀 알려주세요.",1,"카카오페이 몇년째 사용중인데 요즘 상태가 많이 않좋아졌어요 증권도 하고 포인트 모으기도 하면서 시간날때면 항상 페이앱을 열어놓고 있는데 5분정도 사용하면 앱이 다운됩니다. 이상한것은 다운되면 전체가 그런게 아니라 결제창은 잘 열립니다. 가끔 홈창도 열릴때가 있고 하지만 혜택 자산, 증권은 안열립니다. 고객센터 문의했지만 이상 없다고하고 플레이스토어 가서 업데이트 하라고 하고 휴대폰 다시시작해서 사용하라해서 다 해봤는데 똑같아요. 어찌합니까? 내 폰때문일까요? 여태 잘 쓰다가 요즘에 그런건데 답답합니다. 누가 현답 좀 알려주세요.",298
toss,4,"토스 수수료 없는 점이 좋아요 고객선터에 전화하기는 귀찮아서 여기에 남겨요 제가 토스 내에서 한국투자증권 계좌에서 토스 증권 계좌로 송금하는 게 잘 됐는데 갑자기 송금 실패로 뜨면서 ""선택한 계좌에서 출금할 수 없어요. 은행에서 계좌 상태를 확인해주세요.""라고 뜨는데 해결 방법은 없을까요?",1,토스 수수료 없는 점이 좋아요 고객선터에 전화하기는 귀찮아서 여기에 남겨요 제가 토스 내에서 한국투자증권 계좌에서 토스 증권 계좌로 송금하는 게 잘 됐는데 갑자기 송금 실패로 뜨면서 선택한 계좌에서 출금할 수 없어요. 은행에서 계좌 상태를 확인해주세요. 라고 뜨는데 해결 방법은 없을까요?,161
toss,1,업데이트 이후 토스앱 내에 터치 오류가 심해요 한번으로 반응이 없어서 두번 눌러야 하는데 심할땐 3번씩 눌러야 하네요,2,업데이트 이후 토스앱 내에 터치 오류가 심해요 한번으로 반응이 없어서 두번 눌러야 하는데 심할땐 3번씩 눌러야 하네요,65
kakaopay,1,상담사연결안됨. 신분증 인식도 안되어서 출금막힘요...,2,상담사연결안됨. 신분증 인식도 안되어서 출금막힘요..,29
toss,2,이 만보계는 원래 장치의 기존 센서만 사용합니까? 외부 장치로 간주되지 않습니다.,1,이 만보계는 원래 장치의 기존 센서만 사용합니까? 외부 장치로 간주되지 않습니다.,45
kbbank,5,편리했습니다,0,편리했습니다,6
kakaopay,1,이전버전으로 ui돌려요 주식 주문창에서 차트로 바로 이동이 안되서 불편해요,2,이전버전으로 ui돌려요 주식 주문창에서 차트로 바로 이동이 안되서 불편해요,41
toss,4,재밌어요,0,재밌어요,4
toss,1,미션하기로 자꾸 어디 가입유도 좀 하지말아주세요. 부탁 좀 드릴게요. 추가 26년 5월 17일.. 진짜 이제 많이 하는 어플이 됐는데 광고는 더 많아지고 길어지고 토스 쓰는건 더 어렵게 변했네요.. 왜 점점 하향이 되죠ㅜㅜ,2,미션하기로 자꾸 어디 가입유도 좀 하지말아주세요. 부탁 좀 드릴게요. 추가 26년 5월 17일.. 진짜 이제 많이 하는 어플이 됐는데 광고는 더 많아지고 길어지고 토스 쓰는건 더 어렵게 변했네요.. 왜 점점 하향이 되죠ㅜㅜ,124
kbbank,4,간편하고 자녀인증시 최고,0,간편하고 자녀인증시 최고,13
kakaopay,1,어플 내 여기저기 납치 광고 지긋지긋해서 정 떨어진다,2,어플 내 여기저기 납치 광고 지긋지긋해서 정 떨어진다,29
toss,1,"알림이 안 오네요. 설정은 기기에서, 앱에서, 배터리에서 다 되어 있는데요.",1,"알림이 안 오네요. 설정은 기기에서, 앱에서, 배터리에서 다 되어 있는데요.",42
